[
    {
        "id": "girls",
        "filename": "girls.png",
        "frameWidth": 39,
        "frameHeight": 54
    },
    {
        "id": "chara2",
        "filename": "chara2.png",
        "frameWidth": 39,
        "frameHeight": 54
    },
    {
        "id": "chara3",
        "filename": "chara3.png",
        "frameWidth": 39,
        "frameHeight": 54
    },
    {
        "id": "chara4",
        "filename": "chara4.png",
        "frameWidth": 39,
        "frameHeight": 54
    },
    {
        "id": "chara5",
        "filename": "chara4.png",
        "frameWidth": 39,
        "frameHeight": 54
    }
]